{
  "$schema": "http://json-schema.org/draft-07/schema#",
  "title": "HoneyComb Level",
  "$comment": "Contrato de datos entre el editor y el runtime: describe el archivo de un nivel (levels/*.json). Es la unica pieza que los dos modulos comparten, y por eso ninguno de los dos puede cambiarlo por su cuenta. Un campo que se agregue aca hay que agregarlo tambien en editor/src/app/models/level.model.ts (el espejo en TypeScript) y en engine/loader/LevelLoader.cpp (quien lo lee del lado del motor). Los niveles son data-driven: cambiar el juego es cambiar este JSON, sin recompilar el motor.",
  "type": "object",
  "required": ["name", "grid", "entities", "events"],
  "properties": {
    "name": { "type": "string", "description": "Nombre del nivel, para mostrar. No tiene por que coincidir con el del archivo." },
    "grid": {
      "type": "object",
      "description": "Medidas del tablero isometrico: cuantas celdas tiene y cuanto mide cada tile en pixeles.",
      "required": ["width", "height", "tileWidth", "tileHeight"],
      "properties": {
        "width": { "type": "integer", "minimum": 1, "description": "Cantidad de columnas de la grilla." },
        "height": { "type": "integer", "minimum": 1, "description": "Cantidad de filas de la grilla." },
        "tileWidth": {
          "type": "integer",
          "minimum": 1,
          "default": 64,
          "description": "Ancho del tile isometrico en pixeles. Configurable por proyecto/nivel desde el editor; 64 sigue la proporcion estandar 2:1 de pixel art isometrico (tileWidth = 2 * tileHeight)."
        },
        "tileHeight": {
          "type": "integer",
          "minimum": 1,
          "default": 32,
          "description": "Alto del tile isometrico en pixeles. Ver tileWidth."
        }
      }
    },
    "visuals": {
      "type": "object",
      "description": "Opcional. Tiles de piso y de pared con los que el runtime dibuja el 'cuarto' del nivel. Las paredes no son entidades: el motor las genera sobre el borde de la grilla y, si estan, tambien frenan al jugador ahi. Si falta el bloque entero, el nivel se dibuja sin piso ni paredes.",
      "properties": {
        "floor": { "$ref": "#/definitions/visualTile" },
        "wall": { "$ref": "#/definitions/visualTile" }
      }
    },
    "tiles": {
      "type": "array",
      "description": "Celdas que forman la forma irregular del mapa. Si falta, se usa una grilla rectangular con piso completo y pared perimetral.",
      "items": { "$ref": "#/definitions/mapTile" }
    },
    "rooms": {
      "type": "array",
      "description": "Solo del editor: las grillas (salas) que forman el mapa del nivel. El editor las traduce, junto con 'tunnels' y 'tileEdits', a 'tiles', que es lo unico que lee el motor; por eso LevelLoader.cpp no las lee. Si falta, el nivel es una sola grilla.",
      "items": { "$ref": "#/definitions/mapRoom" }
    },
    "tunnels": {
      "type": "array",
      "description": "Solo del editor: pasillos entre dos salas de 'rooms'. Sin 'fromSide', 'toSide' ni 'path' van en L del centro de 'from' al centro de 'to'. Las paredes van por fuera del pasillo.",
      "items": { "$ref": "#/definitions/mapTunnel" }
    },
    "tileEdits": {
      "type": "array",
      "description": "Solo del editor: celdas retocadas a mano con Piso y Pared en un nivel con salas. Se aplican encima de lo que generan las salas y los tuneles, para no perderse al moverlas. Aca una clave ausente significa 'no cambiar', no el default de mapTile.",
      "items": { "$ref": "#/definitions/mapTile" }
    },
    "entities": {
      "type": "array",
      "description": "Todo lo que el diseñador coloca sobre la grilla: jugador, obstaculos, items, sensores.",
      "items": {
        "type": "object",
        "required": ["id", "position", "texture", "sourceRect"],
        "properties": {
          "id": { "type": "string", "description": "Identificador unico dentro del nivel, referenciado por eventos (entity_ref)." },
          "type": { "type": "string", "description": "Tipo/categoria de la entidad (ej. player, obstaculo, item). Libre, uso del editor." },
          "position": {
            "type": "object",
            "description": "Celda de la grilla donde arranca la entidad. Solo enteros: el editor coloca sobre la grilla. En ejecucion el motor mueve en continuo a partir de esta celda.",
            "required": ["col", "row"],
            "properties": {
              "col": { "type": "integer" },
              "row": { "type": "integer" }
            }
          },
          "texture": { "type": "string", "description": "Ruta relativa a assets/ (ver AssetResolver)." },
          "sourceRect": {
            "type": "object",
            "description": "Recorte dentro de la textura, en pixeles. Permite que muchas entidades compartan un mismo spritesheet.",
            "required": ["x", "y", "width", "height"],
            "properties": {
              "x": { "type": "number" },
              "y": { "type": "number" },
              "width": { "type": "number" },
              "height": { "type": "number" }
            }
          },
          "animation": { "type": "string", "description": "Heredado de los niveles viejos. El motor solo reconoce 'player_idle' (2 cuadros de 0.4 s), y solo si la entidad no declara 'frames'. Para animar, usar 'frames' y 'frameDuration'." },
          "frames": {
            "type": "integer",
            "minimum": 1,
            "default": 1,
            "description": "Cuadros de animacion. Van uno al lado del otro en la textura, a partir de 'sourceRect' y del mismo ancho. 1 = el sprite queda quieto. Antes el unico clip estaba escrito en main.cpp con cuadros de 16x16, y eso recortaba a 16x16 a cualquier personaje que lo usara."
          },
          "frameDuration": { "type": "number", "exclusiveMinimum": 0, "default": 0.15, "description": "Segundos por cuadro." },
          "groundOffset": {
            "type": "number",
            "default": 0,
            "description": "Pixeles que el sprite baja respecto de su posicion normal. Por defecto el motor apoya el BORDE INFERIOR del sprite en el punto de la celda, que es lo correcto para un personaje: sus pies quedan ahi. Pero un solido que llena la casilla (un cubo, una rampa) tiene que apoyar el CENTRO del rombo de su base en ese punto -- que es donde el motor centra el tile de piso -- y ese rombo se extiende medio tile mas abajo. Este campo es esa diferencia. 0 (o ausente) = el comportamiento de siempre.",
            "$comment": "Sin este campo no hay forma de dibujar bien un sprite que llena la casilla: las paredes lo resuelven con un offset calculado a mano en main.cpp, que este campo permitiria reemplazar."
          },
          "span": {
            "type": "integer",
            "minimum": 1,
            "default": 1,
            "description": "Celdas por lado que ocupa la entidad, a partir de su position hacia +col y +row: span 3 en la celda 2,2 cubre de 2,2 a 4,4. El motor dibuja el sprite agrandado span veces (el groundOffset tambien) y lo apoya en el centro del bloque. El collider se declara ya del tamano del bloque entero. 1 (o ausente) = una casilla, el comportamiento de siempre."
          },
          "scale": {
            "type": "number",
            "exclusiveMinimum": 0,
            "default": 1,
            "description": "Tamano de dibujo del sprite: 2 = el doble del recorte. Se multiplica con 'span'. No cambia el collider, que se declara aparte en pixeles."
          },
          "stats": {
            "type": "object",
            "description": "Caracteristicas de combate y movimiento. El motor ya usa 'speed' para mover al jugador; 'health' y 'damage' quedan cargadas para el sistema de combate.",
            "properties": {
              "health": { "type": "number", "minimum": 0, "default": 100 },
              "damage": { "type": "number", "minimum": 0, "default": 0 },
              "speed": { "type": "number", "minimum": 0, "default": 3, "description": "Celdas de grilla por segundo." }
            }
          },
          "preset": { "type": "string", "description": "Solo del editor: id del personaje configurado (characters.json) del que salio la entidad. Informativo; el motor no lo lee." },
          "collider": {
            "type": "object",
            "description": "Caja de colision en pixeles. Opcional: si falta, la entidad no participa de la deteccion de contactos.",
            "properties": {
              "width": { "type": "number" },
              "height": { "type": "number" },
              "solid": {
                "type": "boolean",
                "default": false,
                "description": "Si es true, bloquea el movimiento; si es false, solo participa en deteccion de contactos."
              }
            }
          }
        }
      }
    },
    "events": {
      "type": "array",
      "description": "La logica del juego sin escribir codigo, en la forma 'cuando pase X, si se cumple Y, haces Z'. El 'type' de cada paso referencia un ID de schema/event_catalog.json, que es donde se declara que parametros lleva. El motor los evalua una vez por frame, en el orden de este array.",
      "items": {
        "type": "object",
        "required": ["trigger", "actions"],
        "properties": {
          "trigger": {
            "$ref": "#/definitions/eventStep",
            "description": "El 'cuando': que tiene que pasar para que el evento se active. Obligatorio, uno solo."
          },
          "conditions": {
            "type": "array",
            "description": "El 'si': filtros que deben cumplirse TODOS (AND) para que las acciones corran. Opcional; sin condiciones, el trigger alcanza.",
            "items": { "$ref": "#/definitions/eventStep" }
          },
          "actions": {
            "type": "array",
            "description": "El 'entonces': lo que se ejecuta, en este orden, cuando el trigger dispara y las condiciones se cumplen.",
            "items": { "$ref": "#/definitions/eventStep" }
          }
        }
      }
    }
  },
  "definitions": {
    "visualTile": {
      "type": "object",
      "description": "Un tile decorativo del nivel (piso o pared): que imagen usar y que parte de ella recortar.",
      "required": ["texture", "sourceRect"],
      "properties": {
        "texture": { "type": "string" },
        "sourceRect": {
          "type": "object",
          "required": ["x", "y", "width", "height"],
          "properties": {
            "x": { "type": "number" },
            "y": { "type": "number" },
            "width": { "type": "number", "exclusiveMinimum": 0 },
            "height": { "type": "number", "exclusiveMinimum": 0 }
          }
        }
      }
    },
    "mapRoom": {
      "type": "object",
      "description": "Una grilla (sala) del mapa: rectangulo de celdas de piso, con pared alrededor.",
      "required": ["id", "col", "row", "width", "height"],
      "properties": {
        "id": { "type": "string", "description": "Nombre unico de la sala; los tuneles se enganchan por el." },
        "col": { "type": "integer", "minimum": 0 },
        "row": { "type": "integer", "minimum": 0 },
        "width": { "type": "integer", "minimum": 1 },
        "height": { "type": "integer", "minimum": 1 }
      }
    },
    "mapTunnel": {
      "type": "object",
      "description": "Pasillo en L entre dos salas.",
      "required": ["id", "from", "to", "width"],
      "properties": {
        "id": { "type": "string" },
        "from": { "type": "string", "description": "id de la sala de origen." },
        "to": { "type": "string", "description": "id de la sala de destino." },
        "width": { "type": "integer", "minimum": 1, "description": "Ancho del pasillo en celdas caminables." },
        "fromSide": { "$ref": "#/definitions/roomSide", "description": "Lado por el que sale de 'from'. Ausente = desde su centro." },
        "toSide": { "$ref": "#/definitions/roomSide", "description": "Lado por el que entra a 'to'. Ausente = hasta su centro." },
        "path": {
          "type": "array",
          "description": "Puntos de paso trazados a mano, en orden. Entre dos puntos el pasillo va en L. Ausente = en L directa de un extremo al otro.",
          "items": {
            "type": "object",
            "required": ["col", "row"],
            "properties": {
              "col": { "type": "integer" },
              "row": { "type": "integer" }
            }
          }
        }
      }
    },
    "roomSide": {
      "type": "string",
      "enum": ["top", "bottom", "left", "right"],
      "description": "Lado de una sala en los ejes de la grilla: left/right = -columna/+columna, top/bottom = -fila/+fila."
    },
    "mapTile": {
      "type": "object",
      "required": ["col", "row"],
      "properties": {
        "col": { "type": "integer", "minimum": 0 },
        "row": { "type": "integer", "minimum": 0 },
        "floor": { "type": "boolean", "default": true },
        "wall": { "type": "boolean", "default": false }
      }
    },
    "eventStep": {
      "type": "object",
      "description": "Un bloque suelto de un evento. Triggers, condiciones y acciones tienen todos esta misma forma, y por eso el editor y el motor los parsean con el mismo codigo.",
      "required": ["type", "params"],
      "properties": {
        "type": { "type": "string", "description": "ID del bloque en schema/event_catalog.json. Del lado del motor, la clave con la que EventSystem tiene registrada su implementacion." },
        "params": { "type": "object", "description": "Los valores que la persona configuro en el editor. Las claves son las que declara el bloque en el catalogo." }
      }
    }
  }
}
