{
  "name": "test_level_2",
  "grid": {
    "width": 10,
    "height": 10,
    "tileWidth": 64,
    "tileHeight": 32
  },
  "visuals": {
    "floor": {
      "texture": "textures/floor.png",
      "sourceRect": { "x": 0, "y": 0, "width": 64, "height": 64 }
    },
    "wall": {
      "texture": "textures/wall.png",
      "sourceRect": { "x": 0, "y": 0, "width": 32, "height": 32 }
    }
  },
  "tiles": [
    { "col": 1, "row": 1, "floor": true, "wall": true },
    { "col": 2, "row": 1, "floor": true, "wall": true },
    { "col": 3, "row": 1, "floor": true, "wall": true },
    { "col": 4, "row": 1, "floor": true, "wall": true },
    { "col": 5, "row": 1, "floor": true, "wall": true },
    { "col": 6, "row": 1, "floor": true, "wall": true },
    { "col": 7, "row": 1, "floor": true, "wall": true },
    { "col": 8, "row": 1, "floor": true, "wall": true },

    { "col": 1, "row": 2, "floor": true, "wall": true },
    { "col": 2, "row": 2, "floor": true, "wall": false },
    { "col": 3, "row": 2, "floor": true, "wall": false },
    { "col": 4, "row": 2, "floor": true, "wall": false },
    { "col": 5, "row": 2, "floor": true, "wall": false },
    { "col": 6, "row": 2, "floor": true, "wall": false },
    { "col": 7, "row": 2, "floor": true, "wall": false },
    { "col": 8, "row": 2, "floor": true, "wall": true },

    { "col": 1, "row": 3, "floor": true, "wall": true },
    { "col": 2, "row": 3, "floor": true, "wall": false },
    { "col": 3, "row": 3, "floor": true, "wall": false },
    { "col": 4, "row": 3, "floor": true, "wall": false },
    { "col": 5, "row": 3, "floor": true, "wall": false },
    { "col": 6, "row": 3, "floor": true, "wall": true },
    { "col": 7, "row": 3, "floor": true, "wall": false },
    { "col": 8, "row": 3, "floor": true, "wall": true },

    { "col": 1, "row": 4, "floor": true, "wall": true },
    { "col": 2, "row": 4, "floor": true, "wall": false },
    { "col": 3, "row": 4, "floor": true, "wall": false },
    { "col": 4, "row": 4, "floor": true, "wall": false },
    { "col": 5, "row": 4, "floor": true, "wall": false },
    { "col": 6, "row": 4, "floor": true, "wall": false },
    { "col": 7, "row": 4, "floor": true, "wall": false },
    { "col": 8, "row": 4, "floor": true, "wall": true },

    { "col": 1, "row": 5, "floor": true, "wall": true },
    { "col": 2, "row": 5, "floor": true, "wall": false },
    { "col": 3, "row": 5, "floor": true, "wall": false },
    { "col": 4, "row": 5, "floor": true, "wall": true },
    { "col": 5, "row": 5, "floor": true, "wall": true },
    { "col": 6, "row": 5, "floor": true, "wall": false },
    { "col": 7, "row": 5, "floor": true, "wall": false },
    { "col": 8, "row": 5, "floor": true, "wall": true },

    { "col": 1, "row": 6, "floor": true, "wall": true },
    { "col": 2, "row": 6, "floor": true, "wall": false },
    { "col": 3, "row": 6, "floor": true, "wall": false },
    { "col": 4, "row": 6, "floor": true, "wall": false },
    { "col": 5, "row": 6, "floor": true, "wall": false },
    { "col": 6, "row": 6, "floor": true, "wall": false },
    { "col": 7, "row": 6, "floor": true, "wall": false },
    { "col": 8, "row": 6, "floor": true, "wall": true },

    { "col": 1, "row": 7, "floor": true, "wall": true },
    { "col": 2, "row": 7, "floor": true, "wall": false },
    { "col": 3, "row": 7, "floor": true, "wall": false },
    { "col": 4, "row": 7, "floor": true, "wall": false },
    { "col": 5, "row": 7, "floor": true, "wall": false },
    { "col": 6, "row": 7, "floor": true, "wall": false },
    { "col": 7, "row": 7, "floor": true, "wall": false },
    { "col": 8, "row": 7, "floor": true, "wall": true },

    { "col": 2, "row": 8, "floor": true, "wall": true },
    { "col": 3, "row": 8, "floor": true, "wall": true },
    { "col": 4, "row": 8, "floor": true, "wall": false },
    { "col": 5, "row": 8, "floor": true, "wall": false },
    { "col": 6, "row": 8, "floor": true, "wall": false },
    { "col": 7, "row": 8, "floor": true, "wall": true }
  ],
  "entities": [
    {
      "id": "player_1",
      "type": "player",
      "position": { "col": 2, "row": 2 },
      "texture": "textures/player.png",
      "sourceRect": { "x": 0, "y": 0, "width": 16, "height": 16 },
      "animation": "player_idle",
      "collider": { "width": 16, "height": 16 }
    }
    
  ],
  "events": []
}
